{
  "schema_version": "1.0.0",
  "tag": "bran-v1.2.3",
  "repository": "alphazede/developers",
  "source_commit": "aaaaaaaaaaaaaaaaaaaaaaaaaaaaaaaaaaaaaaaa",
  "lockfile_sha256": "bbbbbbbbbbbbbbbbbbbbbbbbbbbbbbbbbbbbbbbbbbbbbbbbbbbbbbbbbbbbbbbb",
  "immutable": true,
  "manifest_asset": "bran-release-manifest.json",
  "assets": [
    { "name": "bran-v1.2.3-x86_64-unknown-linux-gnu.tar.gz", "url": "https://github.com/alphazede/developers/releases/download/bran-v1.2.3/bran-v1.2.3-x86_64-unknown-linux-gnu.tar.gz", "sha256": "1111111111111111111111111111111111111111111111111111111111111111", "media_type": "application/gzip" },
    { "name": "bran-v1.2.3-aarch64-unknown-linux-gnu.tar.gz", "url": "https://github.com/alphazede/developers/releases/download/bran-v1.2.3/bran-v1.2.3-aarch64-unknown-linux-gnu.tar.gz", "sha256": "2222222222222222222222222222222222222222222222222222222222222222", "media_type": "application/gzip" },
    { "name": "bran-v1.2.3-x86_64-apple-darwin.tar.gz", "url": "https://github.com/alphazede/developers/releases/download/bran-v1.2.3/bran-v1.2.3-x86_64-apple-darwin.tar.gz", "sha256": "3333333333333333333333333333333333333333333333333333333333333333", "media_type": "application/gzip" },
    { "name": "bran-v1.2.3-aarch64-apple-darwin.tar.gz", "url": "https://github.com/alphazede/developers/releases/download/bran-v1.2.3/bran-v1.2.3-aarch64-apple-darwin.tar.gz", "sha256": "4444444444444444444444444444444444444444444444444444444444444444", "media_type": "application/gzip" },
    { "name": "bran-v1.2.3-x86_64-pc-windows-msvc.zip", "url": "https://github.com/alphazede/developers/releases/download/bran-v1.2.3/bran-v1.2.3-x86_64-pc-windows-msvc.zip", "sha256": "5555555555555555555555555555555555555555555555555555555555555555", "media_type": "application/zip" },
    { "name": "SHA256SUMS", "url": "https://github.com/alphazede/developers/releases/download/bran-v1.2.3/SHA256SUMS", "sha256": "6666666666666666666666666666666666666666666666666666666666666666", "media_type": "text/plain" },
    { "name": "SHA256SUMS.sig", "url": "https://github.com/alphazede/developers/releases/download/bran-v1.2.3/SHA256SUMS.sig", "sha256": "7777777777777777777777777777777777777777777777777777777777777777", "media_type": "application/pgp-signature" }
  ],
  "checksums": { "asset": "SHA256SUMS", "algorithm": "sha256", "sha256": "6666666666666666666666666666666666666666666666666666666666666666" },
  "signature": { "asset": "SHA256SUMS.sig", "format": "openpgp", "key_fingerprint": "0123456789abcdef0123456789abcdef01234567", "signed_at": "2026-01-01T00:00:00Z" },
  "provenance": { "format": "https://slsa.dev/provenance/v1", "predicate_type": "https://slsa.dev/provenance/v1", "source_repository": "alphazede/developers", "source_commit": "aaaaaaaaaaaaaaaaaaaaaaaaaaaaaaaaaaaaaaaa", "lockfile_sha256": "bbbbbbbbbbbbbbbbbbbbbbbbbbbbbbbbbbbbbbbbbbbbbbbbbbbbbbbbbbbbbbbb", "build_type": "https://alphazede.dev/bran/build/v1" }
}
